<?xml version="1.0" encoding="UTF-8"?>
<!DOCTYPE Biblioteca SYSTEM "file.dtd">
<Biblioteca>
    <libro>
        <titulo>EKR</titulo>
        <año>2004</año>
        <autorref id="A001"></autorref>
    </libro>
    <libro>
        <titulo>HECPROLL</titulo>
        <año>2007</año>
        <autorref id="A002"></autorref>
    </libro>
    <autor id="A001">
        <nombre>Alonso</nombre>
    </autor>
    <autor id="A002">
        <nombre>Pascual</nombre>
    </autor>
</Biblioteca>